{
  "$schema": "https://json-schema.org/draft/2020-12/schema",
  "$id": "https://raw.githubusercontent.com/conuti-gmbh/bo4e-schema/master/schemas/v1/bo/Lokationsbuendel.schema.json",
  "title": "Lokationsbuendel",
  "type": "object",
  "properties": {
    "boTyp": {
      "$ref": "../enum/BOTyp.schema.json",
      "default": "LOKATIONSBUENDEL"
    },
    "versionStruktur": {
      "type": "string",
      "default": "1"
    },
    "lokationsbuendelstrukturId": {
      "type": "string",
      "faker": {
        "string.numeric": 11
      }
    },
    "lokationsbuendelNummer": {
      "type": "integer"
    },
    "standardisierteLokationsbuendelstruktur": {
      "type": "boolean"
    },
    "datenqualitaet": {
      "$ref": "../enum/Datenqualitaet.schema.json"
    },
    "gueltigkeitszeitraum": {
      "$ref": "../com/Zeitraum.schema.json"
    },
    "zuordnungObjectcode": {
      "type": "array",
      "items": {
        "$ref": "../com/ZuordnungObjectcode.schema.json"
      }
    }
  },
  "required": [
    "boTyp",
    "versionStruktur"
  ]
}
