{
  "boTyp": "LOKATIONSBUENDEL",
  "versionStruktur": "1",
  "lokationsbuendelstrukturId": "03606523785",
  "lokationsbuendelNummer": 80912307,
  "standardisierteLokationsbuendelstruktur": false,
  "datenqualitaet": "KEINE_DATEN_ERWARTET",
  "gueltigkeitszeitraum": {
    "zeiteinheit": "VIERTEL_STUNDE",
    "dauer": 0,
    "startdatum": "1895-09-01T16:37:08.0Z",
    "enddatum": "1903-12-14T22:54:38.0Z",
    "einheit": "STUNDE",
    "ableseZeitraum": "972638",
    "abrechnungsZeitraum": "174399",
    "zeitraumText": "ullamco",
    "zeitraumId": 9
  },
  "zuordnungObjectcode": [
    {
      "referenzLokationsTyp": "MALO",
      "referenzLokationsId": "38328496354",
      "vorgelagerteLokationTyp": "MALO",
      "vorgelagerteLokationId": "60214676319",
      "objectcode": [
        {
          "objectcode": "CODE_101011",
          "lokationsbuendelNummer": 10
        }
      ],
      "referenzMarktlokationTechnischeRessource": [
        "82683650808"
      ]
    }
  ]
}